{
  "$schema": "https://json-schema.org/draft/2020-12/schema",
  "$id": "https://cascade.local/schemas/mcp-config.schema.json",
  "title": "Cascade MCP editor configuration",
  "type": "object",
  "required": ["mcpServers"],
  "properties": {
    "$schema": { "type": "string" },
    "_README": { "type": "string" },
    "_inventory": { "type": "string" },
    "_updated": { "type": "string" },
    "_usage": {
      "type": "object",
      "additionalProperties": { "type": "string" }
    },
    "_python_mcp_audit": { "type": "string" },
    "mcpServers": {
      "type": "object",
      "additionalProperties": {
        "type": "object",
        "required": ["command", "args"],
        "properties": {
          "command": { "type": "string" },
          "args": {
            "type": "array",
            "items": { "type": "string" }
          },
          "env": {
            "type": "object",
            "additionalProperties": { "type": "string" }
          },
          "cwd": { "type": "string" }
        },
        "additionalProperties": false
      }
    }
  },
  "additionalProperties": true
}
